ID,Neurodiversity,summarize
2025,ADHD,"The main topic is the challenges faced by a lawyer with ADHD in an in-house legal department, specifically regarding note-taking responsibilities and accommodations without disclosing their condition."
2026,ADHD,"The key topic is about seeking feedback and advice for a portfolio as a beginner in the advertising industry, including concerns about design, industry preferences, and the role of hiring managers in reviewing portfolios."
2027,ADHD,The key topic is struggling with reading comprehension and feeling frustrated about it.
2028,ADHD,The main topic is the struggle of an individual with ADHD and anxiety in their job and seeking suggestions to improve their performance without relying on medication.
2029,ADHD,The main topic is dealing with ADHD in the workplace and how to handle complaints about employees with ADHD.
2030,ADHD,The key topic is disclosing ADD/ADHD to managers and coworkers and its potential impact on perception at the firm.
2031,ADHD,The main topic is ADHD in salespeople.
2032,ADHD,The key topic is seeking non-prescription solutions for ADHD symptoms such as poor attention span and irritability.
2033,ADHD,The key topic is registering ADHD as a disability in the workplace.
2034,ADHD,The main topic is the struggle to stay awake while reading and its possible connection to ADHD.
2035,ADHD,"The main topic is seeking a career coach for professional guidance and support, particularly for individuals with ADHD and feeling stuck in their career."
2036,ADHD,"The key topic is improving quality of care for employees with ADHD through a startup project originated from the author's personal struggles, and the request for input from others through a 20-min interview."
2037,ADHD,The key topic is the use of cognitive aptitude assessments in job interviews and the potential issues and concerns surrounding their relevance and potential discrimination.
2038,ADHD,"The key topic is ""ADHD rage"" or anger experienced by individuals with ADHD."
2039,ADHD,"The key topic is the challenges of balancing work, motherhood, and ADHD."
2040,ADHD,The key topic is disclosing a disability during the job application process and the potential impact on employment possibilities.
2041,ADHD,The key topic is ADHD medication for adults and children.
2042,ADHD,The key topic is the restrictive laws on ADHD medication and potential actions citizens can take to ease them.
2043,ADHD,"The main topic is how to get promoted as a data analyst and seeking advice for it, particularly with ADHD."
2044,ADHD,The key topic is the development of a startup to provide accessible ADHD support for adults and gathering insights on the care journey of corporate ADHDers through a survey.
2045,ADHD,The main topic is the potential correlation between ADHD and the tendency to thrive under last-minute pressure.
2046,ADHD,The key topic is adult ADHD in consulting and seeking tips/advice/help.
2047,ADHD,The main topic is coping with undiagnosed ADHD and its potential impact on anxiety and depression.
2048,ADHD,"The key topic is the individual's search for medication to treat severe ADHD and panic disorder, and their concern about finding a medication that works without causing panic attacks."
2049,ADHD,"The main topic is the potential benefits of harnessing ADHD traits in the workplace, using a successful trial attorney as an example."
2050,ADHD,The main topic is getting diagnosed with ADHD at 40.
2051,ADHD,The main topic is the suitability of consulting as a profession for individuals with ADHD.
2052,ADHD,"The main topic is ""ADHD gadgets for workplace accommodation""."
2053,ADHD,The key topic is the medication shortage and insurance coverage for ADHD medication.
2054,ADHD,The main topic is the challenges of living and working with ADHD and the frustration of dealing with the same expectations as those without ADHD.
2055,ADHD,"The key topic is the struggle to find effective medication for depression, anxiety, and ADHD."
2056,ADHD,"The key topic is seeking book recommendations for working with ADHD, depression, and executive functioning."
2057,ADHD,The main topic is managing phone usage and ADHD.
2058,ADHD,"The main topic is an employee's struggle with stress and health issues, and their boss's response to their request for time off."
2059,ADHD,The main topic is managing ADHD symptoms through organization and rigid routines.
2060,ADHD,The key topic is the effectiveness and side effects of Adderall for adult ADHD.
2061,ADHD,The main topic is the search for an effective solution to ADHD symptoms and frustration with the pharmaceutical industry.
2062,ADHD,The key topic is the use of Zoloft for ADHD and the timeline for seeing its effects.
2063,ADHD,The main topic is coping with mental roadblocks and seeking help for ADHD and ADD.
2064,ADHD,The main topic is seeking advice on accommodations for ADHD.
2065,ADHD,The main topic is the individual's concern about potential undiagnosed ADHD and its impact on their job performance and career advancement.
2066,ADHD,The key topic is the relationship between ADHD and screen time.
2067,ADHD,The main topic is ADHD and its potential impact on brainstorms.
2068,ADHD,The key topic is the accusation of shaming an executive with ADHD by Accenture's global boss Julie Sweet.
2069,ADHD,"The main topic is the struggle to create structure and the need for oversight and consequences in the workplace, including the consideration of accommodations such as ADHD coaching."
2070,ADHD,"The main topic is the challenges faced by the author in the past year, including a company reorg, unstable leadership, ADHD diagnosis, and family impacted by war."
2071,ADHD,The key topic is experiencing ADHD symptoms at work and engaging in inappropriate behavior.
2072,ADHD,The main topic is the use of Adderall for weight loss and its potential impact on ADHD diagnosis.
2073,ADHD,"The main topic is difficulty in discerning sarcasm, possibly related to ADHD."
2074,ADHD,The main topic is the importance of having a solid sleep schedule and the negative effects of pulling all-nighters.
2075,ADHD,The key topic is ADHD prescription and the choice between a primary care physician or a psychiatrist for obtaining it.
2076,ADHD,The main topic is the challenges of starting a new career with ADHD.
2077,ADHD,The key topic is seeking information about getting tested for ADHD in Toronto and associated costs.
2078,ADHD,The key topic is the medication Qelbree and its effectiveness and side effects for treating ADHD.
2079,ADHD,"The main topic is the challenges of completing tasks with ADHD and feeling guilty about taking longer than expected, as well as navigating how to communicate this to a partner without risking less work opportunities."
2080,ADHD,The main topic is the challenges faced by individuals with ADHD in the workplace and the need for accommodating environments.
2081,ADHD,"The main topic is seeking guidance from a career coach, specifically JD Nation, for help with career direction and job dissatisfaction in the legal profession."
2082,ADHD,"The key topic is the individual's struggle with managing their ADHD symptoms after pregnancy and COVID-19, and their concerns about the effectiveness of their medication."
2083,ADHD,"The key topic is seeking recommendations for adult ADHD experts in London, either through the NHS or privately."
2084,ADHD,The key topic is managing stress with ADHD and strategies for remaining productive during and after stressful events.
2085,ADHD,"The key topic is the use of recreational cannabis for treating insomnia in individuals with ADHD, as recommended by a psychiatrist."
2086,ADHD,"The main topic is the lack of understanding and support for neurodiverse employees, specifically those with ADHD, in the workplace."
2087,ADHD,"The key topic is the rising number of ADHD diagnoses in children in the United States, particularly among girls."
2088,ADHD,The key topic is seeking information on obtaining ADHD medication and finding a healthcare provider for it.
2089,ADHD,"The main topic is the individual's interest in exploring marketing analytics and data analysis, and seeking advice on how to start."
2090,ADHD,The key topic is coping with ADHD paralysis during job search.
2091,ADHD,The main topic is forgiving oneself for coping mechanisms and behaviors related to ADHD.
2092,ADHD,The key topic is a startup that aims to provide affordable and effective ADHD treatment by connecting patients with licensed occupational therapists who offer personalized remedial tools and practical techniques.
2093,ADHD,"The main topic is the potential benefits of ADHD, specifically how it can contribute to success in certain situations."
2094,ADHD,"The main topic is how to communicate the reason for taking a sick day when struggling with depression, insomnia, and ADHD symptoms, and the challenges of disclosing mental health issues in the workplace."
2095,ADHD,The key topic is navigating workplace accommodations and disclosures for adults with ADHD.
2096,ADHD,The main topic is distinguishing between ADHD and a lack of discipline when it comes to working from home.
2097,ADHD,The key topic is the experience of coming back from ADHD/PTSD burnout as a self-employed individual.
2098,ADHD,The key topic is managing ADHD in a 3rd-grade child.
2099,ADHD,"The key topic is the potential impact of Wegovy, a weight loss medication, on concentration and the use of ADHD medication, specifically Adderall, to manage this side effect."
2100,ADHD,The main topic is ADHD and the search for an AI tool to assist with it.
2101,ADHD,The main topic is seeking recommendations for ADHD apps.
2102,ADHD,"The key topic is whether to undergo a neuropsychological evaluation to determine the primary issue of anxiety, depression, or ADHD and guide medication changes, versus considering alternative medication options."
2103,ADHD,"The key topic is improving accessibility and quality of care for adults with ADHD, specifically for consultants."
2104,ADHD,The main topic is coping strategies for staying focused during ADHD moments.
2105,ADHD,The main topic is seeking low-cost resources for medication management and treatment for ADHD due to a lack of health insurance and financial constraints.
2106,ADHD,"The key topic is addiction to prescription drugs, specifically ADHD medication."
2107,ADHD,The main topic is the exhaustion and burnout experienced by someone with ADHD due to the demands of work and social expectations.
2108,ADHD,The key topic is finding a personal assistant to handle various tasks for an ADHD household and seeking advice on how to safely vet and interview potential candidates.
2109,ADHD,"The main topic is ""working with ADHD."""
2110,ADHD,The main topic is the lack of preparation provided by law school for individuals with ADHD in the workplace.
2111,ADHD,"The main topic is the experience of having ADHD and experiencing constant music or ""head music"" in one's mind."
2112,ADHD,The main topic is how to manage ADHD while working and billing 8 hours a day.
2113,ADHD,The main topic is the challenges faced by an individual with ADHD and autism in disclosing their condition to their managers and the lack of professional resources for adults with neurodivergent conditions.
2114,ADHD,The key topic is whether having a history of ADHD or AuDHD will be a barrier to receiving a security clearance for a job.
2115,ADHD,The main topic is managing ADHD symptoms while also dealing with Raynaud's.
2116,ADHD,The main topic is creating a program for lawyers with ADHD in a law firm.
2117,ADHD,The key topic is seeking recommendations for an NYC-based psychiatrist who treats ADHD with natural supplements and inquiring about using Nootropics as a substitute for Adderall.
2118,ADHD,The key topic is mental health struggles and workplace challenges faced by an individual with ADHD.
2119,ADHD,The key topic is the use of Wellbutrin for ADHD.
2120,ADHD,The key topic is the possibility of a child having PANDAS (Pediatric Autoimmune Neuropsychiatric Disorders Associated with Streptococcal Infections) and the concern over misdiagnosis and inappropriate medication for related behavioral health symptoms.
2121,ADHD,"The main topic is the Authentic Lawyer Summit, specifically the segment discussing experiences of individuals with ADHD in the legal profession."
2122,ADHD,"The main topic is the individual's struggle with career uncertainty and difficulty transitioning to a new field, particularly in the tech industry, despite having relevant certifications."
2123,ADHD,The main topic is the struggle of managing ADHD while working in a bar and the negative impact it has on the individual's habits and daytime job.
2124,ADHD,The main topic is whether or not to disclose ADHD on an application.
2125,ADHD,The key topic is the potential correlation between anxiety/ADHD and diet.
2126,ADHD,The main topic is managing ADHD and Autism in a corporate job.
2127,ADHD,The key topic is whether to disclose ADHD medication use on a job application and concerns about potential discrimination.
2128,ADHD,The key topic is the shortage of Adderall for individuals with ADHD.
2129,ADHD,The main topic is struggling to keep up with work and feeling rushed to understand cases due to ADHD.
2130,ADHD,The key topic is managing ADHD as a lawyer and coping strategies for improving focus on off days.
2131,ADHD,The main topic is the individual's suspicion of having ADHD and the concern about the cost and potential negative impact on insurance if they get tested.
2132,ADHD,The main topic is seeking help for ADHD without insurance.
2133,ADHD,The key topic is insurance coverage for online providers and prescriptions for individuals with ADHD.
2134,ADHD,The key topic is hyperbaric oxygen therapy for ADHD.
2135,ADHD,"The key topic is the development of a startup to provide accessible ADHD support for adults, based on the personal experience of the MBA candidate who has ADHD. The content includes a request for survey participation to gather insights on the care journey of individuals with ADHD."
2136,ADHD,The main topic is the favorite movie genre for people with ADHD.
2137,ADHD,The main topic is work accommodations for individuals with ADHD or short-term anxiety/depression.
2138,ADHD,The main topic is the search for effective apps to help with ADHD.
2139,ADHD,The key topic is a program for lawyers with ADHD and replicating it in the writer's own firm.
2140,ADHD,The main topic is seeking recommendations for podcasts that provide advice and insights about life/work with ADHD.
2141,ADHD,The main topic is how to reconnect with consultants who supported the individual during the internship recruiting process after a period of communication drop-off due to mental health struggles and embarrassment.
2142,ADHD,The key topic is ADHD's impact on performance in client meetings.
2143,ADHD,The main topic is the self-identification of disabilities in job paperwork and the uncertainty of whether diagnosed mental health conditions affect major life activities.
2144,ADHD,The main topic is the challenges and strategies for transitioning to a new role as a chief of staff and managing multiple responsibilities effectively.
2145,ADHD,The key topic is identifying signs of ADHD.
2146,ADHD,The key topic is the use of TMS for memory loss and ADHD symptoms.
2147,ADHD,The main topic is the empowerment of neurodivergent individuals and the recognition of their unique strengths and abilities.
2148,ADHD,The key topic is non verbal learning disorder/disability (NVLD) and its impact on social and professional life.
2149,ADHD,"The key topic is the potential benefits of a diagnosis of autism spectrum disorder (ASD) for adults, particularly in the workplace."
2150,ADHD,"The main topic is seeking help for mental health and cognitive issues, including the possibility of having bipolar disorder, ADHD, or autism."
2151,ADHD,The key topic is seeking information about the process for receiving GMAT testing accommodations for individuals with ADHD.
2152,ADHD,The key topic is the individual's struggle with undiagnosed ADHD and how it affects their communication and work performance.
2153,ADHD,The main topic is the disclosure of ADHD and its potential consequences in the workplace.
2154,ADHD,The key topic is executive ADHD coaching with a neurodivergent coach.
2155,ADHD,The key topic is subsidized behavioral therapy for adults with ADHD and coaching sessions with licensed occupational therapists.
2156,ADHD,The main topic is how to gain more control over project selection as a junior consultant to explore personal interests and avoid burnout.
2157,ADHD,The main topic is the experience of neurodivergent individuals in sales and the challenges they face in their work.
2158,ADHD,"The key topic is improving accessibility and quality of care for adults with ADHD, specifically for lawyers, through a startup project initiated by a 2nd year MBA student at Harvard Business School."
2159,ADHD,The main topic is an individual struggling to meet the billable hour requirement at their job due to their ADHD diagnosis.
2160,ADHD,"The main topic is whether or not to self-identify as having a disability on job applications, specifically in the context of being a cancer survivor."
2161,ADHD,"The key topic is seeking audiobook recommendations for help with ADHD, specifically for addressing procrastination and analysis paralysis."
2162,ADHD,The main topic is the side effects of medications on individuals with ADHD.
2163,ADHD,"The key topic is the difficulty of finding a doctor who can provide a proper diagnosis and treatment for ADHD in NYC, particularly one who takes new patients and accepts Aetna insurance."
2164,ADHD,The main topic is the challenges of working in consulting with ADHD.
2165,ADHD,The main topic is the difficulty of obtaining ADHD medication in California and the question of whether it is the same in NYC.
2166,ADHD,The main topic is the individual's struggle with anxiety and ADHD while preparing for a job interview while traveling without access to medication.
2167,ADHD,"The key topic is ""learning how to manage ADHD symptoms related to interrupting and tangential conversations."""
2168,ADHD,The key topic is the potential association between ADHD and insomnia.
2169,ADHD,The key topic is seeking recommendations for an ADHD career coach for senior roles with busy schedules.
2170,ADHD,"The key topic is seeking recommendations for an experienced ADHD specialist in the city, specifically for women with ADHD."
2171,ADHD,The key topic is seeking information on free or low-cost virtual treatment options for ADHD without judgment.
2172,ADHD,The key topic is time management systems for individuals with ADHD.
2173,ADHD,The main topic is the diagnosis of ADHD and the relief it brings to the individual who was previously struggling and not believed.
2174,ADHD,"The main topic is the various physical and mental health challenges faced by the individual, which have impacted their employment opportunities."
2175,ADHD,The key topic is managing distractions and being intentional for individuals with ADHD.
2176,ADHD,The key topic is the potential ADHD medication shortages in Dallas.
2177,ADHD,The key topic is seeking ADHD or autism testing and questioning the referral process.
2178,ADHD,"The key topic is the diagnosis and treatment of ADHD, including concerns about misdiagnosis and the effectiveness of medication."
2179,ADHD,"The main topic is ""meeting other professionals with ADHD""."
2180,ADHD,The main topic is the enjoyment of tedious/monotonous work and the question of whether it is unusual or related to ADD/ADHD.
2181,ADHD,The key topic is time management strategies for individuals with ADHD.
2182,ADHD,The main topic is ADHD-related reading recommendations.
2183,ADHD,"The main topic is concerns about a friend's well-being and behavior, including ADHD, substance use, risky sexual behavior, job loss, visa issues, and a recent large purchase."
2184,ADHD,The key topic is coping with ADHD/stress during the luteal phase of the menstrual cycle.
2185,ADHD,"The main topic is how to make the writer's wife understand the struggle of living with major depression, anxiety, severe ADHD, chronic insomnia, and the emotional roller coaster ride that comes with it."
2186,ADHD,The key topic is the use of prescription medication to treat ADHD-like symptoms in individuals with long COVID.
2187,ADHD,"The key topic is improving quality of care for employees with ADHD, specifically for lawyers, through a startup project initiated by a 2nd year MBA student at Harvard Business School."
2188,ADHD,The key topic is the use of Kapvay to treat ADHD as an alternative to stimulants causing insomnia.
2189,ADHD,The key topic is the potential stigma and negative impact on career prospects for taking FMLA leave due to mental health issues in a high-pressure work environment.
2190,ADHD,The main topic is career dissatisfaction and seeking guidance for navigating a difficult work situation.
2191,ADHD,The key topic is ADHD timekeeping and finding a balance between forgetting to bill hours and obsessing over tracking time.
2192,ADHD,The main topic is obtaining ADHD medication in the UAE and whether a prescription from outside the country is recognized.
2193,ADHD,The main topic is how to handle a demanding client load and complex tax issues for people with ADHD or trouble focusing.
2194,ADHD,The key topic is the potential interaction between Ozempic and ADHD medication on dopamine release.
2195,ADHD,"The key topic is Mother's Day and procrastination, specifically in relation to ADHD."
2196,ADHD,The main topic is seeking recommendations for ADHD diagnosis and Adderall prescription in Arlington or DC under United Healthcare.
2197,ADHD,The main topic is finding a coach or mentor with ADHD in the corporate world while dealing with the negative stigma of disclosing it at work.
2198,ADHD,The key topic is an AI ADHD quiz for a second opinion in the ADHD journey.
2199,ADHD,The main topic is regretting the choice of degree due to ADHD and wishing for a non-science heavy degree.
2200,ADHD,The main topic is seeking recommendations for career coaches who specialize in helping individuals with ADHD or identifying the best career path for their creativity and pattern recognition.
2201,ADHD,The key topic is the impact of ADHD or other neurodivergences on salespeople.
2202,ADHD,The main topic is ADHD accountants and their career choice.
2203,ADHD,The main topic is using minimalism as a coping mechanism for ADHD.
2204,ADHD,The main topic is the individual's experience with ADHD medication and the challenges they are facing with side effects and cost.
2205,ADHD,The key topic is the shortage of vyvanse and seeking alternative medication for ADHD.
2206,ADHD,The main topic is ADHD.
2207,ADHD,The main topic is the impact of ADHD on work performance.
2208,ADHD,The key topic is the frustration and disappointment of a nontraditional candidate who was unsuccessful in securing a consulting internship due to ADHD-related weaknesses.
2209,ADHD,The key topic is ADHD awareness and resources.
2210,ADHD,Improving logic and reasoning skills for consulting firm assessments.
2211,ADHD,"The main topic is the author's experience of working in the legal industry with ADHD and their struggle to maintain a job for more than a year, despite being good at presenting themselves and growing a book of business."
2212,ADHD,The main topic is the struggle of choosing a practice area for a lawyer with diverse interests.
2213,ADHD,"The key topic is the blurred line between dependence on medication and addiction to it, specifically in the context of ADHD medication."
2214,OCD,The key topic is joking about OCD at work and the potential consequences.
2215,OCD,The main topic is the misuse of medical conditions as slurs or jokes and the offense it causes.
2216,OCD,The main topic is considering ending a relationship due to feeling unfulfilled and unsupported by an immature partner.
2217,OCD,"The main topic is the struggle of a new mother returning to work and experiencing postpartum depression, anxiety, and OCD while feeling unsupported and overwhelmed."
2218,OCD,The key topic is whether or not to disclose having OCD to one's boss.
2219,OCD,The main topic is dealing with a co-worker's involuntary repetitive noises and the impact it has on the writer's ability to focus and work.
2220,OCD,The main topic is the serious impact of OCD and the frustration with its trivialization as a cute or quirky adjective.
2221,OCD,"The main topic is seeking accommodations for mental health diagnoses such as ADHD, Autism, and OCD."
2222,OCD,The key topic is a high-performing employee in specialty claims who is struggling with a micromanaging boss who is critical and never acknowledges their efforts.
2223,OCD,The key topic is dealing with a partner who is gaslighting and micromanaging in a work environment.
2224,OCD,The main topic is seeking a recommendation for a doctor who treats OCD.
2225,OCD,The key topic is coping strategies for dealing with OCD tendencies without relying on medical help.
2226,OCD,"The main topic is seeking accommodations for mental health diagnoses such as ADHD, Autism, and OCD."
2227,OCD,"The main topic is the relationship between ADHD, anxiety, and OCD-like symptoms, specifically the development of routines and hyper-focus on anxiety."
2228,OCD,The key topic is managing OCD or depression without medication and identifying effective non-medication psychotherapeutic treatments.
2229,OCD,The main topic is the potential impact of medication for OCD on creativity.
