ID,Neurodiversity,summarize
1,Autism,"The key topic is how to address an employee's disclosure of being on the autism spectrum and their behavior of mentioning it frequently, even with customers."
2,Autism,The main topic is considering taking time off to be a stay-at-home mom due to family reasons and financial stability.
3,Autism,The key topic is the emotional struggle of a mother whose 26-year-old daughter has been diagnosed with autism and ADHD and is developmentally at the age of 17.
4,Autism,"The key topic is how to improve social interactions and job performance for an individual with anxiety, depression, ADHD, and autism."
5,Autism,The key topic is autism in the context of big law and how to deal with unsaid rules and accommodations.
6,Autism,The key topic is the potential evaluation for autism of the speaker's daughter.
7,Autism,"The main topic is the challenges faced by individuals with Autism and/or ADHD in a corporate office environment, including feeling out of place, struggling with overwhelm, and seeking coping strategies."
8,Autism,The key topic is vaccinations and their potential link to autism in youth.
9,Autism,The key topic is the challenges and successes of individuals with autism in the working world.
10,Autism,"The main topic is seeking accommodations for mental health diagnoses such as ADHD, Autism, and OCD."
11,Autism,The key topic is disclosing high functioning autism in the workplace.
12,Autism,The main topic is a person with autism seeking advice on how to communicate effectively in order to meet a new colleague and make a good first impression.
13,Autism,The main topic is the challenge of balancing working from home while supporting a child's virtual schooling and addressing potential learning difficulties and the impact on family life.
14,Autism,The key topic is bio/neurofeedback treatment for ADHD and/or autism and its effectiveness.
15,Autism,The main topic is the author's hesitation to work for small agencies again and their concern about how it may be perceived.
16,Autism,The key topic is seeking full-time remote work from home as a reasonable accommodation for ADHD or autism.
17,Autism,The key topic is the inclusion of neurodiversity in DEI programs and the need for awareness and acceptance of autism spectrum in the legal community.
18,Autism,The key topic is transitioning from retail work to remote work due to a recent autism diagnosis.
19,Autism,The key topic is requesting accommodations for autism in the advertising industry.
20,Autism,Personality assessments and ADA concerns
21,Autism,The key topic is the challenges and successes of individuals with autism in the workplace.
22,Autism,The main topic is the experience of an executive with autism who is bored and underpaid in a toxic work environment and seeking advice on how to handle the situation.
23,Autism,"The main topic is seeking accommodations for mental health diagnoses such as ADHD, Autism, and OCD."
24,Autism,The key topic is the challenges of interacting with a father diagnosed with Autism and his difficulty in displaying emotions and engaging in conversations.
25,Autism,The key topic is the negative impact of autism on the individual's mental health.
26,Autism,The main topic is the author's recent diagnosis of being on the autism spectrum and their feelings about it.
27,Autism,The key topic is financial planning for individuals with extenuating circumstances.
28,Autism,The main topic is the difficulty of finding a partner due to shyness and autism.
29,Autism,The main topic is the concern about the genetic risk of having a child with autism and the search for appropriate testing to take precautions.
30,Autism,The key topic is a request for high functioning autists to stop leaning into their autism.
31,Autism,"The main topic is the effectiveness of AI tools, specifically Chat GPT 4.0 and GPT Builder, in assisting individuals with ADD and Autism to create high-quality content."
32,Autism,The main topic is managing travel anxiety without medication for individuals with ADHD and Autism.
33,Autism,"The main topic is the exceptional support provided by the employer for CPI test accommodations for an employee with challenges related to fine motor skills, time reaction, Attention Deficit Disorder, and Autism."
34,Autism,The main topic is the individual's search for new job opportunities as a remote or hybrid consultant after taking a leave to arrange therapy and support for their son following an Autism diagnosis.
35,Autism,The key topic is the individual's decision to change their major to Early Childhood Education with SPEC/Autism certificates and their question about whether to apply for public school now or after their internship.
36,Autism,"The main topic is the individual's interest in exploring marketing analytics and data analysis, and seeking advice on how to start."
37,Autism,"The main topic is seeking assistance with a major financial decision regarding a mortgage, particularly for someone with autism who requires detailed explanations and is facing job loss."
38,Autism,The main topic is the challenges faced by an individual with ADHD and autism in disclosing their condition to their managers and the lack of professional resources for adults with neurodivergent conditions.
39,Autism,The main topic is managing ADHD and Autism in a corporate job.
40,Autism,"The key topic is the potential benefits of a diagnosis of autism spectrum disorder (ASD) for adults, particularly in the workplace."
41,Autism,"The main topic is seeking help for mental health and cognitive issues, including the possibility of having bipolar disorder, ADHD, or autism."
42,Autism,"The main topic is the lack of understanding and support for neurodiverse employees, specifically those with ADHD, in the workplace."
43,Autism,The main topic is the experience of neurodivergent individuals in sales and the challenges they face in their work.
44,Autism,The main topic is the author's struggle with Attention Deficit Disorder and Autism while working as a teaching assistant and their uncertainty about their career path.
45,Autism,The key topic is seeking ADHD or autism testing and questioning the referral process.
46,Autism,The main topic is the job search for school counseling positions in the Sherman/Denison TX area.
47,Autism,The main topic is identifying a suitable job for individuals with high functioning autism.
48,Autism,"The key topic is providing speech therapy for a 10-year-old child with autism, epilepsy, and apraxia who speaks Spanish and whose parent has limited Spanish proficiency."
49,Autism,The main topic is a recent graduate on the Autism spectrum seeking a part-time job with a company experienced in neurodiversity in the Pasadena/Deer Park area to improve social and problem-solving skills.
50,Autism,The main topic is seeking advice from nurses with autism on practicing in healthcare and managing psychosocial aspects.
51,Autism,"The key topic is finding a work, study, and live on site program for a 19-year-old with autism and physical health needs who wants to move on to something with more purpose and freedom."
52,Autism,The key topic is the difficulty in finding someone to conduct an adult assessment for autism.
53,Autism,The main topic is career options for someone with a BA in Psychological Science who does not want to pursue a master's degree and has experience as a Behavior Therapist for children with Autism.
54,Autism,"The key topic is the challenges faced by educators and school staff, including low pay and the need to work multiple jobs, as well as the use of restraint training in a behavior school setting."
55,Autism,The main topic is the challenges of being an autistic leader in the corporate world and seeking tips for overcoming those challenges.
56,Autism,The key topic is the individual's struggle with failing Nonviolent Crisis Prevention & Intervention Training due to having ADHD and Autism and seeking suggestions for what to do next.
57,Autism,The key topic is a career transition from Autism paraprofessional to software development and seeking advice on how to overcome initial screening barriers.
58,Autism,The main topic is employment opportunities for individuals with ADHD and autism.
59,Autism,The main topic is identifying the industry that working with Autism falls under.
60,Autism,The key topic is exploring alternative career paths for individuals with a BCBA or Behavior Analysis degree outside of autism clinics.
61,Autism,The key topic is the development of a potential vaccine to reverse autism and its potential impact on the scientific community and autism therapy.
62,Autism,The key topic is collecting donations for a baby boy diagnosed with Autism who needs financial assistance for therapies.
63,Autism,"The main topic is seeking accommodations for mental health diagnoses such as ADHD, Autism, and OCD, and the effectiveness of these accommodations."
64,Autism,The key topic is navigating autism spectrum disorder at work and disclosing it to employers.
65,Autism,"The key topic is the challenges faced by an unemployed person with a specialized skill set, who is also a caregiver for family members with disabilities and is struggling to make ends meet on public assistance."
66,Autism,The key topic is the individual's professional data certification and their search for job opportunities as a Professional Data Analyst/Data Scientist.
67,Autism,"The main topic is work-related anxiety and its impact on the individual's mental health, particularly for someone on the autism spectrum."
68,Autism,The key topic is seeking resources for understanding and living with a partner on the autism spectrum.
69,Autism,The key topic is raising donations for a baby boy diagnosed with Autism to receive necessary therapies.
70,Autism,The key topic is a person with autism seeking employment advice for a guidance clerk position without prior experience.
71,Autism,The key topic is a job posting for a live-out nanny/babysitter with experience in childcare and special needs in NYC.
72,Autism,"The main topic is a stay-at-home mom's search for job opportunities that accommodate her anxiety and autism, seeking suggestions from others in a similar situation."
73,Autism,The main topic is seeking advice from nurses with autism on practicing in healthcare and managing psychosocial aspects.
74,Autism,The main topic is employment discrimination against individuals with Autism/ADHD during the hiring process.
75,Autism,"The key topic is the struggle of meeting a 2000 billable hour requirement for someone diagnosed with Autism and ADHD, while avoiding burnout."
76,Autism,The main topic is seeking recommendations for a doctor or clinic that offers testing for ADHD and autism symptoms in Orange County or nearby areas.
77,Autism,The key topic is the death of a young child in Ontario due to measles.
78,Autism,The main topic is the individual's desire to transition from a career in audit and compliance due to the challenges faced as a neurodivergent person and seeking suggestions for alternative career paths.
79,Autism,The main topic is the challenge faced by an individual with Autism and ADHD in passing the CPI test and the accommodations provided under the Americans with Disability Act.
80,Autism,The key topic is autism coverage for children of parents who work at PWC NYC.
81,Autism,The key topic is addressing difficulties faced by individuals with ASD or similar conditions in job applications.
82,Autism,"The main topic is disclosing autism and neurodiversity in the workplace and the potential consequences, such as micromanagement."
83,Autism,The main topic is the challenges faced by neurodivergent individuals in corporate offices and the need for accommodations to work productively.
84,Autism,"The main topic is the challenges faced by an individual with level 2 autism who left school early and suffered neglect and abuse, leading to difficulties in obtaining identification, education, and social skills, which have made it challenging to find employment and feel hopeful about"
85,Autism,"The key topic is Attentive Care Services' mission to support individuals with intellectual disabilities and autism in achieving independence and community inclusion through skill development and personal growth, and their search for individuals with customer service skills and experience in this field."
86,Autism,The main topic is the mistreatment and discrimination of an autistic employee in the workplace.
87,Autism,"The main topic is the individual's challenges with social skills and group communication in the workplace, potentially due to undiagnosed autism, and seeking advice on how to communicate with their manager or HR to keep their job."
88,Autism,"The main topic is the struggle to find employment and maintain motivation, particularly for individuals with autism."
89,Autism,The key topic is requesting remote work as a reasonable accommodation for individuals with autism under ADA.
90,Autism,The main topic is the job search for someone with autism and pots syndrome.
91,Autism,"The key topic is how to navigate a predominantly neurotypical workplace while dealing with anxiety, depression, ADHD, autism, and chronic illness."
92,Autism,"The main topic is the challenges faced by an individual with Asperger's, High Functioning Autism, ADHD, and depression in the workplace, including the denial of accommodation requests and subsequent layoff."
93,Autism,The main topic is the individual's struggle to find employment in the tech industry due to a criminal record and neurodivergent conditions.
94,Autism,The main topic is seeking advice from nurses with autism on practicing in healthcare and managing psychosocial aspects.
95,Autism,"The main topic is seeking information on autism-related services in the US, specifically which state to consider moving to."
96,Autism,The key topic is the workplace challenges faced by an autistic person.
97,Autism,"The key topic is the services offered by Dil Nawaz, which include clinical psychology and speech therapy for various issues such as autism, ADHD, behavior problems, psychological problems, domestic issues, and more."
98,Autism,"The key topic is the ""Fajitas & Faith"" event hosted by Edwards Family Entertainment, which benefits Autism Meets Faith."
99,Autism,"The main topic is job opportunities and benefits for BCBA's at Autism Learning Partners, including relocation assistance, 401k match, and new clinic openings."
100,Autism,The main topic is neurodiversity and the challenges faced by individuals with autism and Asperger's Syndrome.
101,Autism,"The main topic is the challenges faced by senior managers with ASD and/or ADHD and how they overcome them in their career, including the support provided by their firms."
102,Autism,"The key topic is the impact of a spouse's high functioning autism on a marriage, including lack of empathy, neglect of needs, and stress caused by undisclosed diagnosis."
103,Autism,The key topic is the formal diagnosis of ASD (Autism Spectrum Disorder) in a child who is graduating elementary school.
104,Autism,"The key topic is the individual's search for work outside of ASD due to being assigned a job that is affecting their mental health, despite having qualifications and experience in education."
105,Autism,The key topic is the inclusion of neurodiversity in DEI programs and the need for awareness and acceptance of autism spectrum in the legal community.
106,Autism,"The key topic is the author's struggles with organizational capability, social awkwardness, and potential diagnoses of ADHD and ASD while working in consulting."
107,Autism,"The key topic is the potential benefits of a diagnosis of autism spectrum disorder (ASD) for adults, particularly in the workplace."
108,Autism,The key topic is the hiring of autistic individuals and the authenticity of Deloitte's DEI messaging in relation to this.
109,Autism,The key topic is addressing difficulties faced by individuals with ASD or similar conditions in job applications.
110,Autism,Transitioning from a PhD in Neuroscience to a Medical Science Liaison job in the UK.
111,Autism,The key topic is the author's interest in finding employment or an internship in the neuroscience field to diagnose individuals with ASD and spread knowledge about the spectrum.
112,Autism,The main topic is a job search for a healthcare management position by an experienced RN with multiple degrees and management experience.
113,Autism,"The main topic is a job opportunity for a BCBA at A&J Behavioral Health, including competitive salaries, benefits, and collaboration with knowledgeable BCBAs to provide ABA to clients with ASD."
114,Schizophrenia,The key topic is dealing with a family member's schizophrenia and the challenges it presents.
115,Schizophrenia,The key topic is the incident of a resident falling out of her wheelchair and the question of whether neglect occurred.
116,Schizophrenia,"The key topic is the challenges faced by the BCG London office, including nepotism and a recent tragedy, leading to mental exhaustion and a sense of corporate schizophrenia."
117,Schizophrenia,The main topic is the concern about the genetic risk of having a child with autism and the search for appropriate testing to take precautions.
118,Schizophrenia,The key topic is the development of a groundbreaking test for detecting hallucinations in advance for schizophrenia treatment.
119,Schizophrenia,The key topic is the link between cats and schizophrenia.
120,Bipolar,The key topic is whether to continue a relationship with someone who has been diagnosed with Bipolar Type 2.
121,Bipolar,The key topic is the challenges and experiences related to bipolar disorder (BPD) and its impact on education and mental health.
122,Bipolar,The main topic is the difficulty of working long hours for individuals with bipolar disorder and the impact of medication on their sleep needs.
123,Bipolar,The main topic is a friend seeking HR advice and permission to use ADA accommodations due to bipolar disorder.
124,Bipolar,The main topic is the misuse of medical conditions as slurs or jokes and the offense it causes.
125,Bipolar,The key topic is dealing with the impact of a parent's likely bipolar disorder and seeking advice on how to cope with the situation.
126,Bipolar,The main topic is the individual's struggle with their current job due to mental illness and their desire to pursue a different career path in supply chain/procurement.
127,Bipolar,The key topic is the challenges faced by an employee with bipolar disorder in filing ADA accommodations and the legality of treating disabilities differently.
128,Bipolar,The main topic is the impact of mental health issues on a romantic relationship.
129,Bipolar,The key topic is managing professional responsibilities while experiencing bipolar symptoms.
130,Bipolar,The key topic is dealing with a spouse's potential bipolar disorder and seeking help for their behavior changes.
131,Bipolar,The key topic is managing a bipolar manager.
132,Bipolar,"The key topic is the challenges faced by a new employee in a small company due to lack of orientation, training plan, and leadership, as well as the impact of the boss's bipolar swings and ADHD on the work environment."
133,Bipolar,The key topic is managing mental health as a bipolar attorney.
134,Bipolar,The main topic is whether or not to disclose bipolar disorder as a disability on job applications.
135,Bipolar,The key topic is dealing with a toxic and negative coworker and the toll it takes on one's spirit.
136,Bipolar,"The key topic is the debate among pastors and Christians regarding the use of mental health medications versus relying on deliverance, fasting, and prayer for treatment."
137,Bipolar,"The key topic is the importance of including academic goals in Individualized Education Programs (IEPs) for students with special needs, particularly those who are emotionally impaired."
138,Bipolar,"The main topic is managing Bipolar Disorder, ADD, and C-PTSD while dealing with project stress."
139,Bipolar,"The key topic is the author's struggles with organizational capability, social awkwardness, and potential diagnoses of ADHD and ASD while working in consulting."
140,Bipolar,The main topic is the author's experience with mental health professionals and their diagnosis of PTSD and Bipolar Disorder after a short evaluation.
141,Bipolar,The key topic is dealing with a difficult and lazy co-worker in a retail job.
142,Bipolar,The key topic is feeling unsupported by lifelong friends despite their promises to be there for someone with bipolar depression.
143,Bipolar,"The main topic is the negative impact of a job on mental health, specifically bipolar disorder."
144,Bipolar,The main topic is discussing whether or not to disclose one's mental illness to colleagues in the workplace.
145,Bipolar,The key topic is domestic abuse and the struggle to escape from an abusive partner.
146,Bipolar,"The main topic is seeking help for mental health and cognitive issues, including the possibility of having bipolar disorder, ADHD, or autism."
147,Bipolar,The main topic is struggling with hearing God's voice during manic episodes caused by bipolar disorder.
148,Bipolar,"The main topic is the various physical and mental health challenges faced by the individual, which have impacted their employment opportunities."
149,Bipolar,The main topic is the dilemma of choosing between retiring and receiving social security or continuing to work despite losing jobs due to bipolar disorder.
150,Bipolar,The main topic is the challenges faced by a new copywriter with bipolar disorder and ADHD during a job interview.
151,Bipolar,"The main topic is the struggle with focusing at work and seeking advice on adult diagnoses, multiple overlapping diagnoses, or misdiagnoses."
152,Bipolar,The key topic is an individual with bipolar disorder who made inappropriate comments to team members and is now facing potential consequences and seeking help.
153,Bipolar,The key topic is the negative work experience and mistreatment by the owner of Eye Contact Vision Center.
154,Bipolar,The main topic is questioning the accuracy of a bipolar diagnosis and the impact of societal stigma on mental illness.
155,Bipolar,The main topic is the challenges of living with bipolar disorder in an Asian American household that does not believe in mental health.
156,Bipolar,The main topic is the duality of the world and how it can be perceived differently by different people.
157,Bipolar,"The key topic is mental health therapy for various conditions such as PTSD, bipolar disorder, anxiety, and depression to promote positive outcomes."
158,Bipolar,The main topic is seeking advice on which virtual IOP program (DBT or CBT) is better for a 66-year-old male with Bipolar who is treatment resistant.
159,Bipolar,The main topic is living with bipolar disorder and the challenges of managing the contrasting states of hypomania and depression.
160,Bipolar,The main topic is the struggle of finding a job while dealing with mental health issues.
161,Bipolar,The main topic is seeking individuals with Bipolar 1 to share their experiences and treatments for an article aimed at helping others understand the condition.
162,Anxiety,The main topic is coping with anxiety and seeking additional tools for managing it.
163,Anxiety,The key topic is anxiety issues in the context of leaving a big law job.
164,Anxiety,The main topic is the experience of being laid off as a consultant and the hope for finding a new job.
165,Anxiety,"The primary topic is the anxiety experienced by job seekers who are unemployed, particularly on weekends, due to the lack of job updates and the influx of rejection emails."
166,Anxiety,The key topic is workplace harassment and how to address it.
167,Anxiety,The main topic is the difficulty of interviewing due to anxiety and the struggle to showcase one's personality during the process.
168,Anxiety,The main topic is coping strategies for individuals with depression and anxiety.
169,Anxiety,The main topic is leaving a big law firm without a job lined up and finding a new job.
170,Anxiety,The main topic is the individual's struggle with anxiety and pressure at work while balancing the responsibilities of raising two children and managing a household.
171,Anxiety,The key topic is workplace harassment and emotional abuse leading to PTSD and anxiety.
172,Anxiety,The main topic is burnout and work-life balance in the legal profession.
173,Anxiety,"The key topic is whether it is considered bad manners to not have your camera on during team meetings when others do, and how anxiety may play a role in this decision."
174,Anxiety,"The key topic is a 12-year-old boy's mental health struggles, including negative self-talk, low confidence, and anxiety, and how to best support and help him."
175,Anxiety,The key topic is the resignation due to the RTO mandate and the negative impact of commuting and open offices on mental health.
176,Anxiety,"The key topic is ""Interview Tips""."
177,Anxiety,"The main topic is the individual's struggles with loneliness, unemployment, weight gain, and mental health issues."
178,Anxiety,The main topic is social anxiety and the struggle to balance humor and professionalism in a young professional career.
179,Anxiety,"The key topic is whether a mother should allow her five-year-old child to stay with their grandmother out of state for a week during the summer, despite the mother's anxiety and being 21 weeks pregnant."
180,Anxiety,"The main topic is the challenges of finding a job and the difficulties faced by job seekers, including job rejections, credit checks, and anxiety during interviews."
181,Anxiety,The key topic is stress management and anxiety coping strategies.
