ID,Neurodiversity,summarize
1218,Anxiety,The key topic is coping with the stress of losing a job.
1219,Anxiety,The key topic is how to overcome a lack of motivation and social anxiety in the early stages of one's career.
1220,Anxiety,The primary topic discussed is the author's upcoming job interview and their use of Kratom to manage body aches and pains.
1221,Anxiety,The main topic is the impact of mental health on job loss and job search.
1222,Anxiety,The main topic is the impact of a high-stress work environment on mental health and the need for self-care.
1223,Anxiety,The key topic is requesting permission to work remotely due to anxiety and unnecessary commuting.
1224,Anxiety,The main topic is career indecision and anxiety while searching for a new job with limited work experience and education.
1225,Anxiety,The key topic is the interview process and the possibility of receiving a job offer for a GLB MKTG role with Merck in NJ.
1226,Anxiety,The key topic is interview anxiety and tips for a video interview with Rangewater.
1227,Anxiety,The key topic is the use of somatic therapies or shaking to alleviate symptoms of anxiety and depression.
1228,Anxiety,The key topic is dealing with a toxic VP and exploring options for addressing the situation.
1229,Anxiety,The main topic is crisis intervention training and improving disengagement skills through the use of visuals and techniques.
1230,Anxiety,The key topic is productivity anxiety in consultants.
1231,Anxiety,The key topic is job search anxiety and repeated rejection.
1232,Anxiety,The main topic is job alternatives for a less stressful and more rewarding career in financial services.
1233,Anxiety,"The main topic is the mental and emotional challenges faced by the individual due to unemployment, long-distance relationship, family health issues, and anxiety."
1234,Anxiety,"The main topic is the individual's struggle with a critical boss, unmotivating work, anxiety, and shattered confidence, and seeking guidance on how to navigate these challenges and rebuild confidence."
1235,Anxiety,The key topic is the use of apps to help with anxiety.
1236,Anxiety,"The main topic is the personal growth and lessons learned from a divorce, including neglecting oneself and the importance of facing reality."
1237,Anxiety,The key topic is coping with anxiety and depression in the legal profession.
1238,Anxiety,The main topic is struggling with ADHD and anxiety and the challenges of completing tasks.
1239,Anxiety,The main topic is the cost and frequency of doctor visits for Xanax prescriptions.
1240,Anxiety,The key topic is managing anxiety during the Marriott voyager program virtual interview process.
1241,Anxiety,The main topic is anxiety related to work and the frustration of someone else undoing one's efforts.
1242,Anxiety,The main topic is the disappointment of not being able to attend an interview due to lack of response from the interviewer.
1243,Anxiety,The main topic is anxiety in response to unexpected meetings with higher-ups.
1244,Anxiety,The key topic is the medication Dyvanel and its effectiveness for the individual who wrote the text.
1245,Anxiety,"The main topic is how to navigate the 60-day bench policy after finishing a project and not having time to network, update a profile, and learn."
1246,Anxiety,The key topic is anxiety related to work.
1247,Anxiety,"The main topic is negotiating for a higher salary for a Senior PM role at a company that does cool work, despite a lower pay range than the current salary."
1248,Anxiety,"The main topic is the individual's struggle with anxiety and depression, and their difficulty finding a job that pays a livable wage."
1249,Anxiety,"The main topic is the individual's struggle with anxiety disorders and OCD, and how their life situation affects their mental health. They are also seeking a job as a painter in Central, N.J."
1250,Anxiety,The key topic is the transition from a large law firm to a smaller one for employment counseling and seeking advice on making a good impression.
1251,Anxiety,The key topic is the individual's experience of anxiety related to work and the recent loss of a loved one.
1252,Anxiety,The key topic is the transition from implementation consulting to FP&A for a restaurant group and the individual's anxiety about the change.
1253,Anxiety,"The key topic is a Master Level Clinician specializing in helping individuals and couples with self-esteem, depression, anxiety, communication, and intimacy issues."
1254,Anxiety,The key topic is the 41-year-old woman's recent development of various medical symptoms and her fear and anxiety surrounding them.
1255,Anxiety,The main topic is the potential side effects of ADHD medication after pregnancy.
1256,Anxiety,"The main topic is a young woman's struggle to find employment as a certified phlebotomist in Hayesville, NC, and surrounding areas."
1257,Anxiety,"The key topic is the availability of Klonopin medication for managing anxiety, panic disorders, and seizures through an online pharmacy with overnight delivery."
1258,Anxiety,The key topic is dealing with a partner's criticism of lack of discipline due to anxiety and sleep troubles.
1259,Anxiety,The key topic is blood clots postpartum and the concern about experiencing mild cramps in the right calf.
1260,Anxiety,"The main topic is the anxiety and fear of the unknown that comes with starting a new job, despite having experience."
1261,Anxiety,The main topic is navigating career transitions and finding support through a job support group and access to a counselor or coach.
1262,Anxiety,The key topic is a phlebotomist seeking employment in a hospital in the Chicago area.
1263,Anxiety,Distress and delusions of control
1264,Anxiety,The main topic is the fear and anxiety triggered by the news of a fellow Christian's divorce and the struggle to navigate out of this mindset.
1265,Anxiety,The main topic is the anxiety and imposter syndrome experienced by an individual working at a school for the first time.
1266,Anxiety,The key topic is obtaining a top-secret clearance with a history of mental health issues.
1267,Anxiety,"The key topic is the author's experience of extreme depression and anxiety as an expat living in the USA, and the financial struggles and support from their husband."
1268,Anxiety,The key topic is starting therapy for work-induced stress and anxiety.
1269,Anxiety,The key topic is the difficulty of transitioning out of a job due to a co-worker's negative reaction.
1270,Anxiety,The key topic is the withdrawal symptoms of Zoloft and how long they will last if the person starts taking it again.
1271,Anxiety,The main topic is a false assumption of a scheduled meeting causing anxiety and sleep deprivation.
1272,Anxiety,The main topic is the fear of leaving a long-term employer for a new opportunity.
1273,Anxiety,The main topic is the owner's concern about their German Shepherd mix's anxiety.
1274,Anxiety,The main topic is job searching during the holidays.
1275,Anxiety,"The main topic is seeking therapy for anxiety, depression, and PTSD resulting from deployment."
1276,Anxiety,The key topic is a cybersecurity professional seeking referrals or leads for remote or local job opportunities.
1277,Anxiety,The key topic is the experience of increased anxiety and depression after longer international vacations.
1278,Anxiety,The main topic is the anxiety and dilemma of choosing between two job offers from Company A and Company B.
1279,Anxiety,The main topic is the potential link between deeply traumatic jobs and physical pain caused by anxiety.
1280,Anxiety,The main topic is struggling with anxiety and repeating patterns despite efforts to use therapy tools.
1281,Anxiety,The main topic is the author's change in perspective on mental health medication and the realization that it is possible to not feel terrible all the time.
1282,Anxiety,"The key topic is whether to accept a job offer at a smaller tech company that aligns with the individual's career goals but has some concerns, or to wait for a better opportunity."
1283,Anxiety,"The key topic is the best type of magnesium for anxiety, brain fog, and cognitive support."
1284,Anxiety,"The key topic is recommendations for alcohol-free drinks for anxiety relief and a ""buzzed"" feeling without impairment."
1285,Anxiety,The main topic is seeking suggestions for easy and realistic actionable steps towards recovery from addiction.
1286,Anxiety,The main topic is identifying a specific condition related to the feeling of losing important items and determining whether it is panic or extended anxiety.
1287,Anxiety,The content does not provide enough information to identify a key topic or theme.
1288,Anxiety,The key topic is separation anxiety in children during daycare drop off.
1289,Anxiety,The key topic is anxiety related to waiting for health test results.
1290,Anxiety,The key topic is the recommendation of using Vitamin B Complex supplement to reduce anxiety and depression symptoms.
1291,Anxiety,The key topic is work-related anxiety and its impact on the ability to enjoy time off.
1292,Anxiety,The main topic is the positive perspective on mental health and personal growth through dealing with anxiety.
1293,Anxiety,The main topic is the request for a work-from-home position due to social anxiety and inability to physically drive.
1294,Anxiety,The main topic is prioritizing values over fear and anxiety when someone does you wrong.
1295,Anxiety,The main topic is job dissatisfaction and burnout in a nursing home due to a new passive-aggressive and rude DON. The author is considering leaving their job.
1296,Anxiety,The main topic is waiting for a response after a final round of a process.
1297,Anxiety,The key topic is seeking recommendations for positive books on anxiety and depression.
1298,Anxiety,The key topic is the decision to start taking Zoloft to treat anxiety symptoms.
1299,Anxiety,The main topic is the level of preparedness for an upcoming job interview due to personal issues causing anxiety and lack of focus.
1300,Anxiety,"The main topic is overcoming anxiety and fear of being the new person in a new workplace, despite having experience in the job."
1301,Anxiety,"The main topic is whether working as a software engineer at CareFirst BlueCross BlueShield in Reston, Virginia provides good work-life balance for contractors and if the work environment is micro-managed."
1302,Anxiety,The main topic is the decision to have a child and overcoming anxiety about it.
1303,Anxiety,The key topic is anxiety caused by social isolation.
1304,Anxiety,The main topic is the struggle of an individual with ADHD and anxiety in their job and seeking suggestions to improve their performance without relying on medication.
1305,Anxiety,"The key topic is the prescription of Lexapro for depression and irritability, concerns about side effects, and potential alternatives."
1306,Anxiety,The key topic is end-of-the-year fatigue and strategies for coping with it.
1307,Anxiety,The main topic is the challenges of returning to work after a leave of absence due to mental health issues and the struggle to manage workload and expectations.
1308,Anxiety,The key topic is whether to wait for the approval of a short term disability claim before giving notice at a current job.
1309,Anxiety,The main topic is the uncertainty of the economy and its impact on career planning and decision-making.
1310,Anxiety,The main topic is taking a two-month break from work due to anxiety and seeking advice on the best approach.
1311,Anxiety,The main topic is a working mother's struggle to disconnect from work before going on maternity leave and dealing with added work pressure from her boss.
1312,Anxiety,The key topic is the safety of taking Ativan during pregnancy for anxiety.
1313,Anxiety,The key topic is the use of acupuncture for anxiety as an alternative to medication.
1314,Anxiety,"The key topic is offering support to individuals struggling with mental health issues such as depression, anxiety, and panic."
1315,Anxiety,The main topic is coping with undiagnosed ADHD and its potential impact on anxiety and depression.
1316,Anxiety,"The key topic is a toxic and bullying work culture in a high-revenue but understaffed company, causing stress, anxiety, and employee turnover."
1317,Anxiety,The key topic is requesting accommodations for case interviews due to anxiety and cognitive difficulties.
1318,Anxiety,The main topic is reintroducing caffeine without triggering anxiety in individuals with GAD.
1319,Anxiety,The main topic is anxiety and job insecurity due to potential layoffs at Liberty.
1320,Anxiety,The key topic is managing anxiety at work.
1321,Anxiety,The main topic is the challenges of working during the first trimester of pregnancy.
1322,Anxiety,The key topic is work-related anxiety.
1323,Anxiety,The main topic is the struggle of coping with anxiety and depression in a toxic work environment and the possibility of seeking accommodations for it.
1324,Anxiety,The main topic is the author's struggle with addiction and mental health after the loss of their grandfather and father.
1325,Anxiety,The main topic is the difficulty of being vulnerable with a sibling who shows bitterness and arrogance due to personal success.
1326,Anxiety,The key topic is the use of medication to manage anxiety in the workplace.
1327,Anxiety,The main topic is the struggle of wanting to start a business while dealing with anxiety and not being fully satisfied with a current job.
1328,Anxiety,"The key topic is the use of inositol for weight loss, PCOS management, and anxiety management."
1329,Anxiety,The main topic is anxiety related to facilitating meetings at work.
1330,Anxiety,The key topic is the author's struggle with anxiety and its negative impact on their life.
1331,Anxiety,The key topic is job loss due to automation or AI and coping mechanisms.
1332,Anxiety,The key topic is the girlfriend's concern about her boyfriend's anxiety regarding introducing her to his friends.
1333,Anxiety,The key topic is anxiety management during the weekend.
1334,Anxiety,The main topic is anxiety related to weekends and not working.
1335,Anxiety,The main topic is the struggle of defining oneself by their career and experiencing anxiety when things go wrong.
1336,Anxiety,The main topic is identifying actions of managers that cause anxiety or stress in employees.
1337,Anxiety,"The main topic is the author's job situation and decision to leave their current receptionist position for a potentially more stable and better-paying representative position in a hospital, despite feeling heartbroken about leaving their current boss."
1338,Anxiety,The key topic is dealing with anxiety related to work responsibilities and pressure to perform in a leadership role.
1339,Anxiety,The main topic is the individual's struggle with feeling constantly tired and unmotivated despite improvements in work and therapy for depression and anxiety.
1340,Anxiety,The main topic is work-related communication and its impact on anxiety.
1341,Anxiety,The key topic is financial stress and its impact on mental health.
1342,Anxiety,The key topic is burnout and its impact on personal and professional life.
1343,Anxiety,The key topic is the side effects and effectiveness of Effexor/Venlafaxine for anxiety and irritability.
1344,Anxiety,The main topic is the negative impact of working at night and the resulting anxiety when interacting with people during the day.
1345,Anxiety,The main topic is managing overwhelming workloads and anxiety in the workplace.
1346,Anxiety,The main topic is managing anxiety and depression after being laid off.
1347,Anxiety,The key topic is salary negotiations and the anxiety associated with it.
1348,Anxiety,"The main topic is experiencing anxiety when having a ""dream job""."
1349,Anxiety,The main topic is struggling with anxiety and repeating patterns despite efforts to use therapy tools.
1350,Anxiety,The main topic is the struggle of a new employee to ask for help and the negative impact it had on their work.
1351,Anxiety,The main topic is the speaker's unemployment and their struggle with anxiety and health issues related to job searching. They are considering starting their own business as an alternative.
1352,Anxiety,The key topic is the emotional distress caused by job loss while dealing with depression and anxiety.
1353,Anxiety,The main topic is managing anxiety and stress during pregnancy.
1354,Anxiety,The main topic is mentoring individuals in Vipassana meditation to help them overcome anxiety.
1355,Anxiety,The key topic is health anxiety and its impact on daily life.
1356,Anxiety,"The key topic is experiencing anxiety/stress rashes in uncomfortable situations with co-workers and seeking insight on prevention, management, or treatment."
1357,Anxiety,The main topic is the lack of communication and respect from recruiters towards job applicants during the hiring process.
1358,Anxiety,The main topic is expressing feelings and communicating effectively with leadership.
1359,Anxiety,The main topic is the exploration of alternative career paths for a litigation attorney who is experiencing anxiety and dissatisfaction with their current job.
1360,Anxiety,The main topic is the challenges faced by an entrepreneur struggling with anxiety and depression and seeking advice on coping mechanisms.
1361,Anxiety,The key topic is disclosing anxiety or ADHD to a partner or HR.
1362,Anxiety,The main topic is social anxiety and feeling isolated.
1363,Anxiety,The key topic is whether it is important to provide documented proof of a mental health condition to HR for protection.
1364,Anxiety,The main topic is how to pass coding interviews and deal with anxiety when applying for a job at a big tech firm.
1365,Anxiety,The main topic is managing anxiety in the workplace and the possibility of using intermittent FMLA for it.
1366,Anxiety,The key topic is the use of propranolol for public speaking anxiety and personal experiences with it.
1367,Anxiety,"The main topic is the career trajectory of a CPA who worked as a senior sales tax auditor for the state and recently joined the IRS as a Revenue Agent, and is considering their future options after 5 years in this role."
1368,Anxiety,The main topic is seeking guidance and support for anxiety and panic disorder.
1369,Anxiety,The main topic is job insecurity and anxiety related to layoffs.
1370,Anxiety,The key topic is obtaining short term disability for stress or anxiety related leave of absence.
1371,Anxiety,"The main topic is the mental health challenges faced by a mother after pregnancy, including anxiety, panic attacks, irritability, and depression."
1372,Anxiety,The key topic is layoff anxiety in the specified area.
1373,Anxiety,The key topic is work-related anxiety outside of work and coping mechanisms.
1374,Anxiety,The key topic is managing anxiety and anxiety treatments.
1375,Anxiety,The main topic is the difficulty of figuring out one's career path and the commonality of this struggle among many people.
1376,Anxiety,The key topic is the use of LYRA therapy for addressing negative mindsets and feelings related to insecure attachments that prevent getting into and maintaining a relationship in the early stages.
1377,Anxiety,The key topic is seeking recommendations for a therapist in downtown to address depression and anxiety.
1378,Anxiety,"The key topic is ""networking with social anxiety."""
1379,Anxiety,"The key topic is experiencing anxiety/stress rashes in uncomfortable situations with co-workers and seeking insight on prevention, management, or treatment."
1380,Anxiety,The key topic is burnout and anxiety in clinical work and considering a transition out of it.
1381,Anxiety,"The main topic is the negative impact of reviewing insurance claims on mental health, specifically increased anxiety."
1382,Anxiety,The key topic is the negative impact of crowded office spaces on mental health and anxiety levels.
1383,Anxiety,The key topic is anxiety related to an upcoming MRI appointment.
1384,Anxiety,"The main topic is whether it is beneficial for a mid-level associate to continue working on urgent one-off assignments outside their practice group for large clients, despite causing stress and anxiety, or to refuse the work for their long-term career."
1385,Anxiety,The key topic is traveling to a client site during pregnancy and concerns related to it.
1386,Anxiety,The main topic is discrimination against individuals with mental health conditions in the workplace.
1387,Anxiety,The key topic is managing anxiety related to work stress and deadlines.
1388,Anxiety,The main topic is the anxiety and pressure experienced by a new CPA due to the fear of making mistakes and being judged by upper management.
1389,Anxiety,The main topic is the impact of anxiety medication on ADD symptoms and the suggestion of disclosing ADD to colleagues to avoid discrimination.
1390,Anxiety,The main topic is the difficulty of obtaining an emotional support animal (ESA) despite having a diagnosed anxiety disorder and the potential consequences of not being able to have one.
1391,Anxiety,The main topic is job interview anxiety and its impact on job prospects.
1392,Anxiety,The main topic is seeking advice on how to approach a new PCP about taking a leave of absence due to severe depression and anxiety.
1393,Anxiety,The main topic is job burnout and the challenges of balancing work and emotional well-being in a capitalist system.
1394,Anxiety,The key topic is managing anxiety in the workplace and finding long-term solutions beyond medication.
1395,Anxiety,The key topic is the author's anticipation of hearing back about their ability to resign from their job.
1396,Anxiety,The key topic is the impact of personal struggles on relationships and mental health.
1397,Anxiety,The key topic is the author's high anxiety after being in a minor accident and their desire to curl up in bed before flying home.
1398,Anxiety,The key topic is the experience of trading anxiety for depression while taking medication.
1399,Anxiety,The main topic is the fear of losing a job due to depression or anxiety affecting job performance and the concern about finding another job if fired.
1400,Anxiety,The main topic is the inadequate management of anxiety symptoms despite medication use and the lack of concern from healthcare providers.
1401,Anxiety,The main topic is career dissatisfaction and the possibility of switching from accounting to another field.
1402,Anxiety,The main topic is the decision to leave a job due to mental exhaustion and a hostile work environment.
1403,Anxiety,The key topic is career dissatisfaction and the decision to accept a job offer at a smaller tech company.
1404,Anxiety,The key topic is coping with emotional eating during times of anxiety and disrupted routines.
1405,Anxiety,The main topic is job performance anxiety and whether to stay at the current company or move on.
1406,Anxiety,The main topic is ruminating or overthinking about the past and relationship anxiety.
1407,Anxiety,The key topic is supporting a friend who received bad news on her NIPT during pregnancy.
1408,Anxiety,"The key topic is the use of propranolol for symptoms of anxiety and panic attacks, including questions about dosage, side effects, and potential weight gain."
1409,Anxiety,"The key topic is whether to undergo a neuropsychological evaluation to determine the primary issue of anxiety, depression, or ADHD and guide medication changes, versus considering alternative medication options."
1410,Anxiety,The key topic is the potential correlation between anxiety/ADHD and diet.
1411,Anxiety,The key topic is coping with grief and mental health struggles after the unexpected death of a loved one.
1412,Anxiety,"The main topic is how to prepare for and succeed in a job interview, particularly for someone with anxiety."
1413,PTSD,The main topic is the unrealistic and excessive job requirements and poor compensation offered in the current job market.
1414,PTSD,The key topic is workplace harassment and emotional abuse leading to PTSD and anxiety.
1415,PTSD,"The main topic is the teacher's decision to quit their job due to experiencing verbal abuse, lack of support, and negative treatment from principals, resulting in PTSD."
1416,PTSD,The main topic is about a husband wanting to convince his wife to allow him to have a gun in the house for protection despite her PTSD.
1417,PTSD,"The main topic is experiencing PTSD from a previous job due to being unappreciated, overlooked, and mistreated by management and colleagues."
1418,PTSD,The main topic is the psychological impact of traumatic experiences on healthcare workers.
1419,PTSD,The main topic is the negative impact of a job on mental health.
1420,PTSD,The main topic is the presence of PTSD in a toxic work environment.
1421,PTSD,The key topic is the potential for PTSD and second-guessing after being laid off and finding a new job.
1422,PTSD,The key topic is the potential for individuals in the industry to suffer from PTSD due to its ups and downs.
1423,PTSD,The key topic is whether or not to relocate for a job opportunity.
1424,PTSD,The main topic is how to support a partner with PTSD resulting from a difficult family situation.
1425,PTSD,The main topic is the experience of PTSD from past employers and how to overcome it.
1426,PTSD,The main topic is job burnout and the decision to return to a previous employer.
1427,PTSD,The main topic is job insecurity and the impact of layoff PTSD on job performance.
1428,PTSD,The key topic is PTSD in a toxic work environment.
1429,PTSD,The main topic is leaving a toxic work environment and the emotional aftermath.
1430,PTSD,The main topic is the positive impact of marriage on overcoming sexual fears and reservations.
