ID,Neurodiversity,summarize
598,Anxiety,"The key topic is unemployment and mental health struggles, specifically depression and anxiety."
599,Anxiety,The key topic is job interview anxiety and its impact on performance.
600,Anxiety,"The key topic is experiencing severe anxiety-like attacks and ADHD symptoms while taking medication for ADHD, specifically Adderall, and seeking advice from others who may have experienced the same situation."
601,Anxiety,The main topic is social anxiety and the challenge of networking for shy individuals.
602,Anxiety,The main topic is the experience of being diagnosed with ADHD and anxiety later in life and the impact it had on the individual's job performance and mental health.
603,Anxiety,"The main topic is career advancement strategies for a Director of Talent Acquisition seeking to become a VP, including the consideration of obtaining a SHRM or AIHR credential and seeking alternative suggestions."
604,Anxiety,The main topic is the search for non-client facing roles in order to alleviate anxiety caused by client relationship management.
605,Anxiety,The main topic is overcoming struggles and finding happiness through self-care and perseverance.
606,Anxiety,The main topic is the anxiety and emotional challenges of returning to work after being home with a child for an extended period of time.
607,Anxiety,The key topic is annual performance reviews causing anxiety and stress.
608,Anxiety,The key topic is the worsening of anxiety despite taking Zoloft.
609,Anxiety,The main topic is the individual's decision to disclose their mental health condition to their leader due to medication changes.
610,Anxiety,"The main topic is the struggle of an individual with stress and anxiety due to being pigeonholed into a role and blocked from moving to another position within the company, and their consideration of taking a mental health leave."
611,Anxiety,The key topic is how to approach a difficult hiring manager who is also the VP of HR in a business setting.
612,Anxiety,The main topic is how to deal with Sunday scaries and anxiety related to work.
613,Anxiety,"The key topic is a toddler's behavior of requiring 100% attention and throwing tantrums when parents show affection to each other, and whether it is a form of separation anxiety."
614,Anxiety,"The key topic is seeking recommendations for therapists in the Chicago area to address work demands, marriage issues, and depression/anxiety related to family issues."
615,Anxiety,The key topic is the effectiveness of Microsoft Teams for communication and its impact on productivity and well-being.
616,Anxiety,The main topic is the duration of the hiring process and the likelihood of receiving a response from JetBlue after a virtual interview for a Ground Operations position.
617,Anxiety,"The main topic is the challenges and struggles of adjusting to a new country after getting married, including feelings of homesickness, anxiety, difficulty making friends, and career setbacks."
618,Anxiety,"The main topic is seeking recommendations for a retreat or wellness trip to recover from exhaustion, anxiety, and mental health issues."
619,Anxiety,"The main topic is the individual's struggle with depression, anxiety, and panic in relation to their job and the potential impact of the 2025 job market."
620,Anxiety,The key topic is requesting advice on how to apply for FMLA for mental health reasons.
621,Anxiety,The main topic is struggling with anxiety and isolation while living with family expectations to be productive and not sleep excessively.
622,Anxiety,The main topic is the struggle of balancing mental health issues and caring for a child as a result of being laid off.
623,Anxiety,The key topic is the writer's concern for their significant other who is experiencing extreme depersonalization and seeking advice on how to support them.
624,Anxiety,The key topic is mental health and seeking treatment for anxiety and depression.
625,Anxiety,The key topic is social anxiety related to going out with new people.
626,Anxiety,The key topic is the writer's concern for their significant other who is experiencing extreme depersonalization and seeking advice on how to support them.
627,Anxiety,The key topic is mental health and seeking treatment for anxiety and depression.
628,Anxiety,The key topic is social anxiety related to going out with new people.
629,Anxiety,The main topic is a relationship issue related to infidelity and feelings of inadequacy.
630,Anxiety,The key topic is anxiety in the early stages of dating.
631,Anxiety,The main topic is loneliness and struggles with alcohol addiction recovery.
632,Anxiety,The main topic is the challenges of being in an avoidant relationship during the pandemic.
633,Anxiety,"The main topic is the individual's lack of motivation, stress, and anxiety related to starting a new job and passing probation."
634,Anxiety,"The key topic is seeking mental help for ADHD and anxiety, and the prescription of Zoloft as a potential solution."
635,Anxiety,The key topic is anxiety paralysis.
636,Anxiety,"The key topic is ""Tips for nailing an interview for an HR position with anxiety."""
637,Anxiety,The key topic is dealing with a bullying partner in the workplace.
638,Anxiety,The main topic is anxiety related to waiting.
639,Anxiety,The key topic is the combination of Adderall and Xanax for treating ADHD and anxiety.
640,Anxiety,The main topic is a new employee's concern about their personal information being shared on social media by their employer and how to address this issue.
641,Anxiety,"The key topic is seeking encouragement and success stories for treating anxiety and depression after the age of 30, particularly related to regaining self-belief."
642,Anxiety,The key topic is navigating a difficult relationship with a manager causing anxiety in the workplace.
643,Anxiety,"The key topic is ""quick ways to reduce anxiety in daily life."""
644,Anxiety,The main topic is leaving a job for a new opportunity and dealing with anxiety and uncertainty about the change.
645,Anxiety,The main topic is coping with anxiety during remote presentations.
646,Anxiety,The key topic is social anxiety and the struggle to overcome it through meeting and talking with new people.
647,Anxiety,The key topic is job opportunities for a 17-year-old with no experience and social anxiety.
648,Anxiety,The key topic is humanizing the hiring process and providing rejection feedback to candidates.
649,Anxiety,The key topic is the safety of using topical retinoids during pregnancy.
650,Anxiety,The main topic is whether or not to disclose mental health issues to HR.
651,Anxiety,The main topic is the experience of depression and anxiety despite having positive life circumstances.
652,Anxiety,The key topic is seeking advice on whether to lateral due to a toxic boss affecting mental health.
653,Anxiety,The main topic is the fear and anxiety related to potential layoffs in the organization.
654,Anxiety,The key topic is the negative impact of a noisy and open office environment on the mental health of an individual with generalized anxiety and the search for solutions to address this issue.
655,Anxiety,The key topic is the negative impact of workplace toxicity on mental health.
656,Anxiety,"The main topic is the individual's decision to take Wellbutrin for anxiety, depression, and self-worth issues, while also considering potential side effects and stigma."
657,Anxiety,"The main topic is a lawyer's dilemma of switching from a law firm to an in-house position due to the challenges of business development, billing, and work-life balance."
658,Anxiety,"The key topic is ""bad anxiety."""
659,Anxiety,"The main topic is the conflict between being a founder and starting a family, and the struggle to balance business success with personal life."
660,Anxiety,The key topic is managing flight anxiety or fear of flying.
661,Anxiety,"The main topic is the author's struggle with mental health, specifically anxiety and depression."
662,Anxiety,The main topic is the possibility of being misdiagnosed with depression instead of ADHD due to family history and personal symptoms.
663,Anxiety,"The key topic is the importance of including academic goals in Individualized Education Programs (IEPs) for students with special needs, particularly those who are emotionally impaired."
664,Anxiety,The main topic is anxiety related to returning to work after a two-week break.
665,Anxiety,"The main topic is the individual's struggle with anxiety, stress, and the use of medication and substances to manage their symptoms."
666,Anxiety,The key topic is the minimum acceptable advance notice for calendar meetings and best practices for scheduling meetings.
667,Anxiety,The main topic is experiencing a panic attack at work and dealing with the aftermath.
668,Anxiety,The main topic is whether or not to disclose past traumatic experiences to a romantic partner and how it may affect the relationship.
669,Anxiety,The main topic is work anxiety on Sunday nights.
670,Anxiety,The key topic is the individual's struggle with anxiety and its impact on their job performance and daily life.
671,Anxiety,The main topic is the negative impact of social media on mental health and how taking a break from it can alleviate anxiety.
672,Anxiety,The main topic is postpartum anxiety related to leaving a 6 1/2 month old baby for the first time.
673,Anxiety,"The key topic is the emotional distress caused by being estranged from parents due to neglect and financial abuse, and the pressure from grandparents to reconcile with them."
674,Anxiety,The main topic is social anxiety and how to deal with it during an offsite.
675,Anxiety,The key topic is how to support a significant other who is struggling with anxiety and depersonalization while traveling for work.
676,Anxiety,"The main topic is the relationship between ADHD, anxiety, and OCD-like symptoms, specifically the development of routines and hyper-focus on anxiety."
677,Anxiety,"The main topic is the stress and anxiety caused by a complex and overwhelming new job, and the dilemma of whether to stay for the financial benefits or leave for a simpler job."
678,Anxiety,The main topic is the speaker's regret for seeking help for depression and anxiety due to doctors dismissing their concerns as psychosomatic.
679,Anxiety,The key topic is severe anxiety and coping strategies.
680,Anxiety,"The key topic is binge eating as a coping mechanism for stress and anxiety, leading to physical discomfort and negative impact on health and appearance."
681,Anxiety,The main topic is the individual's struggle with overwhelming anxiety at work and whether they should quit or take stress leave to find a better fit for their mental health.
682,Anxiety,The main topic is the relief of being diagnosed with ADHD and Anxiety and understanding how the symptoms feed each other.
683,Anxiety,The key topic is the anxiety and overwhelm experienced on the first day back to work after an extended period of unemployment.
684,Anxiety,The main topic is the feasibility of traveling with a large dog with separation anxiety.
685,Anxiety,The main topic is the speaker's experience of being laid off and their struggle to find new employment.
686,Anxiety,"The main topic is the author's reflection on their unique journey at 30, including challenges with anxiety and depression and working on healthier coping mechanisms."
687,Anxiety,The key topic is the difficulty of finding a suitable therapist and the inadequate insurance coverage for mental health.
688,Anxiety,The key topic is seeking advice on couples counseling or therapy for relationship anxiety and mental health.
689,Anxiety,The key topic is the use of non-habit-forming anxiety medication and potential addiction or dependency issues.
690,Anxiety,"The key topic is optimizing a childcare plan, specifically considering the available combined company benefits and personal preferences for in-home versus center care."
691,Anxiety,The key topic is managing anxiety and staying present in a romantic relationship.
692,Anxiety,The main topic is financial anxiety related to retirement and job dissatisfaction at an older age.
693,Anxiety,The main topic is anxiety related to facilitating meetings at work.
694,Anxiety,"The key topic is a negative work experience in the pharmaceutical industry leading to depression and anxiety, followed by difficulty finding a new job and considering alternative employment options."
695,Anxiety,The main topic is unemployment and job insecurity.
696,Anxiety,The key topic is managing stress and anxiety during a busy season.
697,Anxiety,The key topic is seeking recommendations for therapists or outpatient programs specializing in work-related anxiety.
698,Anxiety,"The main topic is anxiety and seeking therapy, specifically the possibility of text therapy as a more comfortable option."
699,Anxiety,The key topic is the negative impact of a job on mental health and the dilemma of whether to continue working in a harmful environment for the sake of credibility.
700,Anxiety,The key topic is the negative impact of excessive smoking/vaping on long-term mental health.
701,Anxiety,"The key topic is the work culture and environment at MERU, specifically in their Data Insights team."
702,Anxiety,"The main topic is the difficulty of maintaining social connections due to anxiety, mental health, and low energy levels."
703,Anxiety,"The main topic is managing Bipolar Disorder, ADD, and C-PTSD while dealing with project stress."
704,Anxiety,The main topic is expressing gratitude towards the Glassdoor Ad community for their support and advice during a job hunt.
705,Anxiety,The main topic is job-related anxiety and depression.
706,Anxiety,The main topic is managing anxiety in the context of a consulting career.
707,Anxiety,The key topic is the positive impact of leaving a toxic job on mental and emotional health.
708,Anxiety,The key topic is workplace conflict and anxiety caused by a strained relationship with a leader.
709,Anxiety,The main topic is seeking advice on how to take time off work to focus on mental health while dealing with personal struggles and anxiety.
710,Anxiety,The key topic is the experience of taking Adderall and the consideration of switching to Vyvanse.
711,Anxiety,The main topic is work-related anxiety on weekends.
712,Anxiety,The main topic is managing spending habits and debt for individuals with ADHD.
713,Anxiety,"The primary topic is the ongoing struggle with grief, depression, and anxiety after the loss of a spouse."
714,Anxiety,The main topic is burnout and the desire to quit work due to stress and anxiety.
715,Anxiety,The main topic is how to manage ADHD/Anxiety and prioritize family and work responsibilities by improving sleep habits.
716,Anxiety,The main topic is the difficulty and anxiety associated with completing expense reports.
717,Anxiety,The key topic is dealing with a toxic VP and exploring options for addressing the situation.
718,Anxiety,The main topic is coping with anxiety in 1:1 meetings with management after being laid off.
719,Anxiety,The key topic is anxiety related to canceling plans with friends due to work obligations.
720,Anxiety,The main topic is the struggle of unemployment and its impact on mental health.
721,Anxiety,The key topic is taking medical leave for mental health.
722,Anxiety,The key topic is the relationship between anxiety and ADD (Attention Deficit Disorder) in a person in their early 50s.
723,Anxiety,The key topic is the frequency of required visits for medication refills and the potential motivation behind it.
724,Anxiety,The main topic is seeking information about receiving accommodations for ADD/Anxiety.
725,Anxiety,The key topic is managing anxiety during early pregnancy after experiencing a previous loss.
726,Anxiety,The main topic is overcoming anxiety and depression and finding hope for those who are struggling.
727,Anxiety,The key topic is managing anxiety during the interview process.
728,Anxiety,The key topic is anxiety related to a business presentation.
729,Anxiety,The main topic is how to overcome nervousness and prepare for a marketing summer internship interview.
730,Anxiety,The key topic is the dilemma of whether to reschedule an interview after ghosting due to anxiety and how to explain the previous absence if brought up.
731,Anxiety,The main topic is the struggle with anxiety and imposter syndrome when offered a management position after a long break due to health issues.
732,Anxiety,The key topic is anxiety-induced nausea and seeking tips to alleviate it.
733,Anxiety,The key topic is anxiety about the upcoming COVID wave in fall/winter.
734,Anxiety,The key topic is dealing with social anxiety on the day of the wedding.
735,Anxiety,The key topic is the difficulty of finding and keeping a job due to severe anxiety and major depression disorder.
736,Anxiety,The key topic is the experience of starting Vyvanse and its potential impact on anxiety.
737,Anxiety,The key topic is coping with impatience related to anxiety.
738,Anxiety,"The main topic is the speaker's feelings of boredom, anxiety, and depression due to their monotonous routine of work and home life, as well as their desire to save money to purchase their own home."
739,Anxiety,The main topic is career change and the challenges of transitioning from customer service/CSR management to a new field without prior experience.
740,Anxiety,The main topic is the importance of building connections and friendships within the local community to overcome social anxiety and the belief of needing to do everything alone.
741,Anxiety,The key topic is the work-life balance in the tech industry and its impact on mental health.
742,Anxiety,The key topic is work-related anxiety and panic attacks.
743,Anxiety,The key topic is ending a relationship with a live-in partner and the logistical challenges that come with it.
744,Anxiety,The key topic is the use of fear as a motivational tool in mentoring and whether it is appropriate or not.
745,Anxiety,The main topic is job dissatisfaction and career-related depression.
746,Anxiety,The main topic is job insecurity and potential layoff.
747,Anxiety,The main topic is the isolation and anxiety experienced by the sister's teenage son during the pandemic and the lack of communication about him from his parents.
748,Anxiety,The key topic is the discomfort and anxiety caused by being required to be on camera for team meetings.
749,Anxiety,The main topic is the individual's concern about chest pains caused by work and seeking advice on how to address it.
750,Anxiety,The key topic is work-related anxiety.
751,Anxiety,The main topic is the dilemma of attending monthly general meetings for home office employees who suffer from social anxiety and whether they should advocate for access to a live stream.
752,Anxiety,The main topic is an employee's plan to take medical leave due to a relationship breakdown with their partner who is also their employer.
753,Anxiety,The main topic is the realization of the negative impact of stress and anxiety caused by work on job performance and the feeling of pointlessness with work.
754,Anxiety,The key topic is the caregiver's frustration and anxiety about not feeling like they are doing enough to make their patient happy.
755,Anxiety,"The key topic is the negative impact of a toxic manager on the writer's health and well-being, and the need to find a new job."
756,Anxiety,"The main topic is the challenges of anxiety and depression in the workplace, including difficulty with productivity and communication."
757,Anxiety,The main topic is job insecurity and the desire for a permanent position while working from home due to health concerns.
758,Anxiety,The main topic is the anxiety and uncertainty surrounding leaving a law firm and transitioning to an in-house role with an unclear career trajectory.
759,Anxiety,"The main topic is the individual's struggle with severe anxiety caused by years of high stress and bad management, leading to a desire to scale back their role and retire in six years."
760,Anxiety,The main topic is job search anxiety.
761,Anxiety,The main topic is the author's concern about their work quality and feedback from their consultant/manager.
762,Anxiety,The key topic is work-related burnout and stress management.
763,Anxiety,The key topic is the possibility that anxiety could be caused by a parasite infection and the potential solution of a ketogenic diet.
764,Anxiety,The main topic is anxiety medication and its potential relationship to sales-related anxiety.
765,Anxiety,The main topic is overcoming anxiety about learning to use a cash register for an assistant manager position.
766,Anxiety,The key topic is the use of GABA for anxiety and depression.
767,Anxiety,The main topic is the individual's struggles with job instability and its impact on their mental health.
768,Anxiety,The key topic is the frustration with having a middleman for PA results and the suggestion to release the results to everyone on a workday.
769,Anxiety,"The main topic is the individual's desire to leave their current role in strategy and pursue opportunities as a STEM instructor, specifically inquiring about potential opportunities at PwC or other consulting firms."
770,Anxiety,"The main topic is the difficulty of transitioning into Big Law and the impact it has on mental health, specifically for individuals with ADHD and anxiety."
771,Anxiety,The key topic is whether to ask for a reduced hours schedule due to work overload and resulting anxiety affecting sleep and performance.
772,Anxiety,The main topic is the difficulty of finding a good and honest dentist in the city.
773,Anxiety,The main topic is coping with anxiety-related snacking and seeking tips to stop or redirect the behavior.
774,Anxiety,The main topic is coping with a mental breakdown caused by a toxic work environment and the struggle to balance job responsibilities with personal well-being.
775,Anxiety,The key topic is the anxiety and stress caused by minor errors and grading practices in a part-time master's program.
776,Anxiety,The main topic is the feeling of boredom and the desire for instability and emotional rollercoasters.
777,Anxiety,The key topic is anxiety or panic attacks during labor.
778,Anxiety,The main topic is dealing with notice period anxiety while waiting for a new job to start.
779,Anxiety,The key topic is how to overcome anxiety during an MBA interview.
780,Anxiety,The main topic is prioritizing self-care and not allowing toxic situations to negatively impact one's well-being.
781,Anxiety,The key topic is seeking recommendations for intensive outpatient therapy for anxiety and depression in NYC.
782,Anxiety,The key topic is the effectiveness of therapy and how to determine if a therapist is a good fit.
783,Anxiety,The key topic is the search for legitimate remote data entry jobs for introverts with anxiety.
784,Anxiety,The main topic is coping strategies for dealing with a bad day or week and managing anxiety.
785,Anxiety,"The main topic is how to take care of mental health in relation to stress and anxiety, both at work and outside of work."
786,Anxiety,The key topic is unemployment and job search struggles.
787,Anxiety,"The key topic is the individual's struggle with general anxiety and seeking tips or advice on how to manage it, including whether to seek medical help."
788,Anxiety,The key topic is seeking a psychiatrist in the city who can assist with short term leave paperwork for major anxiety.
789,Anxiety,The key topic is the individual's struggle with health anxiety and their recent diagnosis of elevated LDL cholesterol.
790,Anxiety,The main topic is the struggle with anxiety and depression after losing a job as a server at a small mom and pop diner.
791,Anxiety,The key topic is work-related anxiety and considering going back to school.
792,Anxiety,"The main topic is the individual's desire to change jobs due to a toxic work environment and mental health issues, and their search for remote job opportunities or a company with a better work environment."
793,Anxiety,The main topic is the financial situation and anxiety of a person who has recently completed 2 years in their professional career.
794,Anxiety,"The main topic is job dissatisfaction and considering options for addressing it, including changing companies or taking a demotion."
795,Anxiety,The key topic is experiencing sporadic pains around the body and wondering if it is related to anxiety.
796,Anxiety,"The main topic is the individual's struggle with feeling picked on about their weight and joblessness, leading to feelings of stress, anxiety, and depression."
797,Anxiety,The key topic is the pressure to marry and the negative impact it has on the individual's well-being.
798,Anxiety,The key topic is test anxiety and its impact on the ability to apply for graduate programs.
799,Anxiety,"The key topic is whether a history of mental health issues, specifically panic attacks, depression, and anxiety, can be an obstacle to obtaining a top-secret clearance."
800,Anxiety,The main topic is social anxiety at work and difficulty forming relationships with coworkers.
801,Anxiety,"The main topic is seeking recommendations or tips for finding a therapist in Chicago to address anxiety, depression, and addictive behaviors."
802,Anxiety,The key topic is recommendations for books or podcasts that can help improve depression and anxiety.
803,Anxiety,The main topic is the individual's struggle with anxiety and seeking advice to cope with it in their role as an FDD.
804,Anxiety,The key topic is meditation and its potential benefits for stress and anxiety.
805,Anxiety,The key topic is work anxiety and imposter syndrome.
